{
  "protocol_version": "1",
  "request_id": "11111111-1111-4111-8111-111111111113",
  "operation": "select",
  "worker_kind": "skill_router",
  "goal": "Select the best matching skill for the user request.",
  "evidence": [
    {
      "ref": "evidence://sha256/e0e0e0e0e0e0e0e0e0e0e0e0e0e0e0e0e0e0e0e0e0e0e0e0e0e0e0e0e0e0e0e0",
      "kind": "user_input",
      "trust_tier": "untrusted",
      "source": "user prompt"
    }
  ],
  "candidates": ["cand-alpha"],
  "constraints": { "max_choices": 2, "input_token_budget": 800 },
  "deadline": { "queue_ms": 25, "execution_ms": 100 },
  "policy_ref": "policy-v1",
  "provenance": { "client": "zhoor-cli", "session_ref": "session-0012" }
}
