{
  "protocol_version": "1",
  "request_id": "33333333-3333-4333-8333-333333333333",
  "operation": "extract",
  "worker_kind": "risk_judge",
  "goal": "Extract the maintenance window fields from the evidence.",
  "evidence": [
    {
      "ref": "evidence://sha256/c3c3c3c3c3c3c3c3c3c3c3c3c3c3c3c3c3c3c3c3c3c3c3c3c3c3c3c3c3c3c3c3",
      "kind": "external_document",
      "trust_tier": "verified",
      "source": "vendor-maintenance-page"
    }
  ],
  "candidates": [],
  "constraints": { "max_choices": 1, "input_token_budget": 400 },
  "deadline": { "queue_ms": 25, "execution_ms": 100 },
  "policy_ref": "extract-policy-v1",
  "provenance": { "client": "zhoor-cli", "session_ref": "session-0003" }
}